Name,Description,Latitude,Longitude,InfoURL,ImageURL
UCSB,A great university located along the California coast,34.416929,-119.845991,"https://en.wikipedia.org/wiki/University_of_California,_Santa_Barbara",https://www.history.ucsb.edu/wp-content/uploads/LagoonFall2014-banner.jpg
CSM,A decent community college located at North California,37.54,-122.34,https://en.wikipedia.org/wiki/College_of_San_Mateo,https://upload.wikimedia.org/wikipedia/commons/thumb/3/31/CSM_Entrance.jpg/1920px-CSM_Entrance.jpg
Twin Peaks,"A fomous scenic spot in San Francisco, a pair of 922 foot-high summits.",37.75,-122.45,https://en.wikipedia.org/wiki/Twin_Peaks,https://upload.wikimedia.org/wikipedia/commons/1/11/Twin_Peaks-San_Francisco.jpg
Golden Gate Bridge,A gigantic landmark bridge in San Francisco that connects the bay and the Pacific Ocean,37.8199,-122.4783,https://en.wikipedia.org/wiki/Golden_Gate_Bridge,https://upload.wikimedia.org/wikipedia/commons/thumb/0/0c/GoldenGateBridge-001.jpg/1280px-GoldenGateBridge-001.jpg
Miami South Beach,"A beautiful beach at the south side of Miami Beach, known for tourism.",25.78,-80.13,https://en.wikipedia.org/wiki/South_Beach,https://upload.wikimedia.org/wikipedia/commons/3/3e/Miamimetroarea.jpg
Lake Tahoe,A famous fresh water lake known for tourism and skiing in California,39.0968,-120.0324,https://en.wikipedia.org/wiki/Lake_Tahoe,https://upload.wikimedia.org/wikipedia/commons/thumb/d/da/Tahoe_North_Shore_from_the_East_Shore.jpg/1920px-Tahoe_North_Shore_from_the_East_Shore.jpg
